{
  "slug": "luffa-05-fertilization-top2",
  "version": 1,
  "status": "draft",
  "crop_slug": "luffa",
  "season": "year_round",
  "stage": "fertilization",
  "order_idx": 5,
  "day_after_planting": {"min": 56, "max": 56, "unit": "days"},
  "title": {
    "en": "2nd top dressing — 8 weeks after planting",
    "si": "දෙවන අතිරේක පොහොර — සිටුවා සති 8 කට පසු",
    "ta": "இரண்டாவது மேல் உரம் — நடவுக்குப் பின் 8 வாரங்கள்",
    "si_status": "machine_draft",
    "ta_status": "machine_draft"
  },
  "body": {
    "en": "Apply Urea 75 kg/ha and MOP 60 kg/ha as the second top dressing at eight weeks after planting.",
    "si": "සිටුවා සති 8 කට පසු යූරියා හෙක්ටයාරයට 75 kg සහ MOP 60 kg දෙවන අතිරේක පොහොර ලෙස යොදන්න.",
    "ta": "நடவுக்குப் பின் எட்டு வாரங்களில் யூரியா ஹெக்டேருக்கு 75 kg மற்றும் MOP 60 kg இரண்டாவது மேல் உரமாக வழங்கவும்.",
    "si_status": "machine_draft",
    "ta_status": "machine_draft"
  },
  "inputs": [
    {"type": "fertilizer", "name": {"en": "Urea", "si": "යූරියා", "ta": "யூரியா", "si_status": "machine_draft", "ta_status": "machine_draft"}, "amount": 75, "unit": "kg", "per_unit_area": "hectare"},
    {"type": "fertilizer", "name": {"en": "Muriate of Potash (MOP)", "si": "පොටෑෂ් මියුරියේට්", "ta": "மியூரியேட் ஆஃப் பொட்டாஷ் (MOP)", "si_status": "machine_draft", "ta_status": "machine_draft"}, "amount": 60, "unit": "kg", "per_unit_area": "hectare"}
  ],
  "field_provenance": {
    "inputs": {
      "source_id": "doa",
      "source_url": "https://doa.gov.lk/hordi-crop-luffa/",
      "fetched_at": "2026-04-17T00:00:00Z",
      "quote": "Top Dressing 2: Urea 75, MOP 60 kg/ha, 8 weeks after planting"
    }
  }
}
