{
  "slug": "okra-06-fertilization-top3",
  "version": 1,
  "status": "draft",
  "crop_slug": "okra",
  "season": "year_round",
  "stage": "fertilization",
  "order_idx": 6,
  "day_after_planting": {"min": 56, "max": 56, "unit": "days"},
  "title": {
    "en": "3rd top dressing — 8 weeks after planting",
    "si": "තෙවන අතිරේක පොහොර — සිටුවා සති 8 කට පසු",
    "ta": "மூன்றாவது மேல் உரம் — நடவுக்குப் பின் 8 வாரங்கள்",
    "si_status": "machine_draft",
    "ta_status": "machine_draft"
  },
  "body": {
    "en": "Apply Urea 100 kg/ha and MOP 50 kg/ha as the third top dressing at eight weeks after planting.",
    "si": "සිටුවා සති 8 කට පසු යූරියා හෙක්ටයාරයට 100 kg සහ MOP 50 kg තෙවන අතිරේක පොහොර ලෙස යොදන්න.",
    "ta": "நடவுக்குப் பின் எட்டு வாரங்களில் யூரியா ஹெக்டேருக்கு 100 kg மற்றும் MOP 50 kg மூன்றாவது மேல் உரமாக வழங்கவும்.",
    "si_status": "machine_draft",
    "ta_status": "machine_draft"
  },
  "inputs": [
    {"type": "fertilizer", "name": {"en": "Urea", "si": "යූරියා", "ta": "யூரியா", "si_status": "machine_draft", "ta_status": "machine_draft"}, "amount": 100, "unit": "kg", "per_unit_area": "hectare"},
    {"type": "fertilizer", "name": {"en": "Muriate of Potash (MOP)", "si": "පොටෑෂ් මියුරියේට්", "ta": "மியூரியேட் ஆஃப் பொட்டாஷ் (MOP)", "si_status": "machine_draft", "ta_status": "machine_draft"}, "amount": 50, "unit": "kg", "per_unit_area": "hectare"}
  ],
  "field_provenance": {
    "inputs": {
      "source_id": "doa",
      "source_url": "https://doa.gov.lk/hordi-crop-okra/",
      "fetched_at": "2026-04-17T00:00:00Z",
      "quote": "At 8 weeks: 100 kg urea, 50 kg MOP per hectare."
    }
  }
}
