{
  "slug": "brinjal-03-fertilization-top1",
  "version": 1,
  "status": "draft",
  "crop_slug": "brinjal",
  "season": "year_round",
  "stage": "fertilization",
  "order_idx": 3,
  "day_after_planting": {"min": 28, "max": 28, "unit": "days"},
  "title": {
    "en": "1st top dressing — 4 weeks after transplanting",
    "si": "පළමු අතිරේක පොහොර — සිටුවා සති 4 කට පසු",
    "ta": "முதல் மேல் உரம் — நடவுக்குப் பின் 4 வாரங்கள்",
    "si_status": "machine_draft",
    "ta_status": "machine_draft"
  },
  "body": {
    "en": "Apply Urea 75 kg/ha as the first top dressing four weeks after transplanting.",
    "si": "සිටුවා සති 4 කට පසු යූරියා හෙක්ටයාරයට 75 kg පළමු අතිරේක පොහොර ලෙස යොදන්න.",
    "ta": "நடவுக்குப் பின் நான்கு வாரங்களில் யூரியா ஹெக்டேருக்கு 75 kg முதல் மேல் உரமாக வழங்கவும்.",
    "si_status": "machine_draft",
    "ta_status": "machine_draft"
  },
  "inputs": [
    {"type": "fertilizer", "name": {"en": "Urea", "si": "යූරියා", "ta": "யூரியா", "si_status": "machine_draft", "ta_status": "machine_draft"}, "amount": 75, "unit": "kg", "per_unit_area": "hectare"}
  ],
  "field_provenance": {
    "inputs": {
      "source_id": "doa",
      "source_url": "https://doa.gov.lk/hordi-crop-brinjal/",
      "fetched_at": "2026-04-17T00:00:00Z",
      "quote": "Week 4: Urea 75 kg/ha"
    }
  }
}
