{
  "slug": "tomato-04-fertilization-top1",
  "version": 1,
  "status": "draft",
  "crop_slug": "tomato",
  "season": "year_round",
  "stage": "fertilization",
  "order_idx": 4,
  "day_after_planting": {"min": 21, "max": 21, "unit": "days"},
  "title": {
    "en": "1st top dressing — 3 weeks after planting",
    "si": "පළමු අතිරේක පොහොර — සිටුවා සති 3 කට පසු",
    "ta": "முதல் மேல் உரம் — நடவுக்குப் பின் 3 வாரங்கள்",
    "si_status": "machine_draft",
    "ta_status": "machine_draft"
  },
  "body": {
    "en": "Apply Urea 65 kg/ha as the first top dressing at three weeks after planting.",
    "si": "සිටුවා සති 3 කට පසු යූරියා හෙක්ටයාරයට 65 kg පළමු අතිරේක පොහොර ලෙස යොදන්න.",
    "ta": "நடவுக்குப் பின் மூன்று வாரங்களில் யூரியா ஹெக்டேருக்கு 65 kg முதல் மேல் உரமாக வழங்கவும்.",
    "si_status": "machine_draft",
    "ta_status": "machine_draft"
  },
  "inputs": [
    {
      "type": "fertilizer",
      "name": {"en": "Urea", "si": "යූරියා", "ta": "யூரியா", "si_status": "machine_draft", "ta_status": "machine_draft"},
      "amount": 65,
      "unit": "kg",
      "per_unit_area": "hectare"
    }
  ],
  "field_provenance": {
    "inputs": {
      "source_id": "doa",
      "source_url": "https://doa.gov.lk/hordi-crop-tomato/",
      "fetched_at": "2026-04-17T00:00:00Z",
      "quote": "1st Top Dressing: 65 kg/ha Urea at 03 weeks after planting"
    }
  }
}
