{
  "slug": "tomato-03-transplanting",
  "version": 1,
  "status": "draft",
  "crop_slug": "tomato",
  "season": "year_round",
  "stage": "transplanting",
  "order_idx": 3,
  "day_after_planting": {"min": 0, "max": 0, "unit": "days"},
  "title": {
    "en": "Transplanting and basal fertiliser",
    "si": "සිටුවීම සහ මුල් පොහොර යෙදීම",
    "ta": "நடவு மற்றும் அடிப்படை உர வழங்கல்",
    "si_status": "machine_draft",
    "ta_status": "machine_draft"
  },
  "body": {
    "en": "Transplant seedlings at 80 cm × 50 cm spacing. Apply the basal fertiliser mix 1–2 days before planting: Urea 65 kg/ha, TSP 325 kg/ha, MOP 65 kg/ha.",
    "si": "පැළ 80 cm × 50 cm පරතරයකින් සිටුවන්න. සිටුවීමට දින 1–2 කට පෙර මුල් පොහොර යොදන්න: යූරියා හෙක්ටයාරයට 65 kg, TSP 325 kg, MOP 65 kg.",
    "ta": "நாற்றுகளை 80 cm × 50 cm இடைவெளியில் நடவு செய்யவும். நடவுக்கு 1–2 நாட்களுக்கு முன் அடிப்படை உரக் கலவை வழங்கவும்: யூரியா ஹெக்டேருக்கு 65 kg, TSP 325 kg, MOP 65 kg.",
    "si_status": "machine_draft",
    "ta_status": "machine_draft"
  },
  "inputs": [
    {
      "type": "fertilizer",
      "name": {"en": "Urea", "si": "යූරියා", "ta": "யூரியா", "si_status": "machine_draft", "ta_status": "machine_draft"},
      "amount": 65,
      "unit": "kg",
      "per_unit_area": "hectare",
      "notes": {
        "en": "Apply 1–2 days before planting as part of basal dressing.",
        "si": "මුල් පොහොර ලෙස සිටුවීමට දින 1–2 කට පෙර යොදන්න.",
        "ta": "அடிப்படை உரமாக நடவுக்கு 1–2 நாட்களுக்கு முன் வழங்கவும்.",
        "si_status": "machine_draft",
        "ta_status": "machine_draft"
      }
    },
    {
      "type": "fertilizer",
      "name": {"en": "Triple Super Phosphate (TSP)", "si": "TSP පොස්පේට්", "ta": "டிரிப்பிள் சூப்பர் பாஸ்பேட் (TSP)", "si_status": "machine_draft", "ta_status": "machine_draft"},
      "amount": 325,
      "unit": "kg",
      "per_unit_area": "hectare"
    },
    {
      "type": "fertilizer",
      "name": {"en": "Muriate of Potash (MOP)", "si": "පොටෑෂ් මියුරියේට්", "ta": "மியூரியேட் ஆஃப் பொட்டாஷ் (MOP)", "si_status": "machine_draft", "ta_status": "machine_draft"},
      "amount": 65,
      "unit": "kg",
      "per_unit_area": "hectare"
    }
  ],
  "field_provenance": {
    "body": {
      "source_id": "doa",
      "source_url": "https://doa.gov.lk/hordi-crop-tomato/",
      "fetched_at": "2026-04-17T00:00:00Z",
      "quote": "Spacing: 80 cm x 50 cm"
    },
    "inputs": {
      "source_id": "doa",
      "source_url": "https://doa.gov.lk/hordi-crop-tomato/",
      "fetched_at": "2026-04-17T00:00:00Z",
      "quote": "Basal: 65 kg/ha Urea, 325 kg/ha TSP, 65 kg/ha MOP applied 1-2 days before planting"
    }
  }
}
