{
  "slug": "kekiri-03-thinning",
  "version": 1,
  "status": "draft",
  "crop_slug": "kekiri",
  "season": "year_round",
  "stage": "weed_management",
  "order_idx": 3,
  "day_after_planting": {"min": 14, "max": 14, "unit": "days"},
  "title": {
    "en": "Thinning — 2 weeks after emergence",
    "si": "පැළ තුනී කිරීම — පැළවීමේ සති 2 කට පසු",
    "ta": "நாற்றுகளை மெலிதாக்குதல் — முளைத்த 2 வாரங்கள்",
    "si_status": "machine_draft",
    "ta_status": "machine_draft"
  },
  "body": {
    "en": "At two weeks after emergence, remove the weak seedlings and leave 2 healthy seedlings per pit.",
    "si": "පැළවී සති 2 කට පසු දුර්වල පැළ ඉවත් කර, එක් කුහරයකට නීරෝගී පැළ 2 ක් පමණක් ඉතිරි කරන්න.",
    "ta": "முளைத்து இரண்டு வாரங்களுக்குப் பின், பலவீனமான நாற்றுகளை அகற்றி ஒரு குழியில் 2 ஆரோக்கியமான நாற்றுகளை விட்டுவிடவும்.",
    "si_status": "machine_draft",
    "ta_status": "machine_draft"
  },
  "field_provenance": {
    "body": {
      "source_id": "doa",
      "source_url": "https://doa.gov.lk/hordi-crop-kekiri/",
      "fetched_at": "2026-04-17T00:00:00Z",
      "quote": "At 2 weeks of emerging, remove weak seedlings allowing two healthy seedlings to grow"
    }
  }
}
